{
  "$schema": "https://json-schema.org/draft/2020-12/schema",
  "$id": "https://tilefoundry.dev/schemas/warpgroup-schedule.schema.json",
  "title": "TileFoundry Warpgroup Schedule",
  "type": "object",
  "additionalProperties": false,
  "required": ["format", "lanes", "sync", "times"],
  "properties": {
    "format": {"const": "tilefoundry.warpgroup_schedule"},
    "lanes": {"type": "array", "minItems": 1, "items": {"type": "array", "uniqueItems": true, "items": {"$ref": "#/$defs/id"}}},
    "sync": {"type": "array", "uniqueItems": true, "items": {"type": "object", "additionalProperties": false, "required": ["after", "before", "distance"], "properties": {"after": {"$ref": "#/$defs/id"}, "before": {"$ref": "#/$defs/id"}, "distance": {"$ref": "#/$defs/nonNegativeInteger"}}}},
    "times": {"type": "array", "items": {"type": "array", "prefixItems": [{"$ref": "#/$defs/nonNegativeInteger"}, {"$ref": "#/$defs/id"}, {"$ref": "#/$defs/nonNegativeInteger"}, {"$ref": "#/$defs/positiveInteger"}, {"$ref": "#/$defs/positiveInteger"}], "items": false, "minItems": 5, "maxItems": 5}}
  },
  "$defs": {
    "id": {"type": "string", "pattern": "^[A-Za-z_][A-Za-z0-9_.-]*$", "not": {"pattern": "[\\r\\n]"}},
    "positiveInteger": {"type": "integer", "minimum": 1},
    "nonNegativeInteger": {"type": "integer", "minimum": 0}
  }
}
