{
  "format": "tilefoundry.warpgroup_schedule",
  "lanes": [
    [
      "qk0_8",
      "qk0_0",
      "qk0_7",
      "qk0_6",
      "qk0_5",
      "qk0_4",
      "qk0_3",
      "qk0_1",
      "qk0_2",
      "softmax0",
      "copy_state0",
      "scale_o_left0",
      "pv0_left",
      "scale_p0",
      "copy_p0_shared",
      "scale_o_left1",
      "pv1_left"
    ],
    [
      "qk1_5",
      "qk1_8",
      "qk1_4",
      "qk1_2",
      "qk1_0",
      "qk1_1",
      "qk1_7",
      "qk1_3",
      "qk1_6",
      "softmax1",
      "scale_o_right",
      "pv1_right",
      "copy_state1",
      "copy_p1_shared",
      "pv0_right"
    ],
    [
      "copy_kv0_8",
      "copy_kv0_0",
      "copy_kv1_5",
      "copy_kv1_4",
      "copy_kv0_1",
      "copy_kv1_8",
      "copy_kv1_7",
      "copy_kv0_7",
      "copy_kv0_6",
      "copy_kv0_5",
      "copy_kv0_4",
      "copy_kv0_3",
      "copy_kv0_2",
      "copy_kv1_2",
      "copy_validity",
      "copy_kv1_0",
      "copy_kv1_1",
      "copy_kv1_3",
      "copy_kv1_6"
    ]
  ],
  "sync": [
    {
      "after": "copy_kv0_0",
      "before": "qk0_0",
      "distance": 0
    },
    {
      "after": "copy_kv0_1",
      "before": "qk0_1",
      "distance": 0
    },
    {
      "after": "copy_kv0_2",
      "before": "qk0_2",
      "distance": 0
    },
    {
      "after": "copy_kv0_3",
      "before": "qk0_3",
      "distance": 0
    },
    {
      "after": "copy_kv0_4",
      "before": "qk0_4",
      "distance": 0
    },
    {
      "after": "copy_kv0_5",
      "before": "qk0_5",
      "distance": 0
    },
    {
      "after": "copy_kv0_6",
      "before": "qk0_6",
      "distance": 0
    },
    {
      "after": "copy_kv0_7",
      "before": "qk0_7",
      "distance": 0
    },
    {
      "after": "copy_kv0_8",
      "before": "qk0_8",
      "distance": 0
    },
    {
      "after": "copy_kv1_0",
      "before": "qk1_0",
      "distance": 0
    },
    {
      "after": "copy_kv1_1",
      "before": "qk1_1",
      "distance": 0
    },
    {
      "after": "copy_kv1_2",
      "before": "qk1_2",
      "distance": 0
    },
    {
      "after": "copy_kv1_3",
      "before": "qk1_3",
      "distance": 0
    },
    {
      "after": "copy_kv1_4",
      "before": "qk1_4",
      "distance": 0
    },
    {
      "after": "copy_kv1_5",
      "before": "qk1_5",
      "distance": 0
    },
    {
      "after": "copy_kv1_6",
      "before": "qk1_6",
      "distance": 0
    },
    {
      "after": "copy_kv1_7",
      "before": "qk1_7",
      "distance": 0
    },
    {
      "after": "copy_kv1_8",
      "before": "qk1_8",
      "distance": 0
    },
    {
      "after": "copy_p0_shared",
      "before": "pv0_right",
      "distance": 0
    },
    {
      "after": "copy_p1_shared",
      "before": "pv1_left",
      "distance": 0
    },
    {
      "after": "copy_state0",
      "before": "softmax1",
      "distance": 0
    },
    {
      "after": "copy_state1",
      "before": "scale_p0",
      "distance": 0
    },
    {
      "after": "copy_validity",
      "before": "softmax0",
      "distance": 0
    },
    {
      "after": "pv0_left",
      "before": "copy_kv0_0",
      "distance": 1
    },
    {
      "after": "pv0_left",
      "before": "scale_o_left1",
      "distance": 0
    },
    {
      "after": "pv0_right",
      "before": "copy_kv0_7",
      "distance": 1
    },
    {
      "after": "pv1_left",
      "before": "copy_kv1_2",
      "distance": 1
    },
    {
      "after": "pv1_right",
      "before": "copy_kv1_5",
      "distance": 1
    },
    {
      "after": "pv1_right",
      "before": "pv0_right",
      "distance": 0
    },
    {
      "after": "qk0_0",
      "before": "softmax0",
      "distance": 0
    },
    {
      "after": "qk0_1",
      "before": "softmax0",
      "distance": 0
    },
    {
      "after": "qk0_2",
      "before": "softmax0",
      "distance": 0
    },
    {
      "after": "qk0_3",
      "before": "softmax0",
      "distance": 0
    },
    {
      "after": "qk0_4",
      "before": "softmax0",
      "distance": 0
    },
    {
      "after": "qk0_5",
      "before": "softmax0",
      "distance": 0
    },
    {
      "after": "qk0_6",
      "before": "softmax0",
      "distance": 0
    },
    {
      "after": "qk0_7",
      "before": "softmax0",
      "distance": 0
    },
    {
      "after": "qk0_8",
      "before": "copy_kv0_8",
      "distance": 1
    },
    {
      "after": "qk0_8",
      "before": "softmax0",
      "distance": 0
    },
    {
      "after": "qk1_0",
      "before": "softmax1",
      "distance": 0
    },
    {
      "after": "qk1_1",
      "before": "softmax1",
      "distance": 0
    },
    {
      "after": "qk1_2",
      "before": "softmax1",
      "distance": 0
    },
    {
      "after": "qk1_3",
      "before": "softmax1",
      "distance": 0
    },
    {
      "after": "qk1_4",
      "before": "softmax1",
      "distance": 0
    },
    {
      "after": "qk1_5",
      "before": "softmax1",
      "distance": 0
    },
    {
      "after": "qk1_6",
      "before": "softmax1",
      "distance": 0
    },
    {
      "after": "qk1_7",
      "before": "softmax1",
      "distance": 0
    },
    {
      "after": "qk1_8",
      "before": "softmax1",
      "distance": 0
    }
  ],
  "times": [
    [
      0,
      "copy_kv0_0",
      114,
      228,
      539
    ],
    [
      0,
      "copy_kv0_1",
      456,
      570,
      881
    ],
    [
      0,
      "copy_kv0_2",
      1368,
      1482,
      1793
    ],
    [
      0,
      "copy_kv0_3",
      1254,
      1368,
      1679
    ],
    [
      0,
      "copy_kv0_4",
      1140,
      1254,
      1565
    ],
    [
      0,
      "copy_kv0_5",
      1026,
      1140,
      1451
    ],
    [
      0,
      "copy_kv0_6",
      912,
      1026,
      1337
    ],
    [
      0,
      "copy_kv0_7",
      798,
      912,
      1223
    ],
    [
      0,
      "copy_kv0_8",
      0,
      114,
      425
    ],
    [
      0,
      "copy_kv1_0",
      1710,
      1824,
      2135
    ],
    [
      0,
      "copy_kv1_1",
      1824,
      1938,
      2249
    ],
    [
      0,
      "copy_kv1_2",
      1482,
      1596,
      1907
    ],
    [
      0,
      "copy_kv1_3",
      1938,
      2052,
      2363
    ],
    [
      0,
      "copy_kv1_4",
      342,
      456,
      767
    ],
    [
      0,
      "copy_kv1_5",
      228,
      342,
      653
    ],
    [
      0,
      "copy_kv1_6",
      2052,
      2166,
      2477
    ],
    [
      0,
      "copy_kv1_7",
      684,
      798,
      1109
    ],
    [
      0,
      "copy_kv1_8",
      570,
      684,
      995
    ],
    [
      0,
      "copy_p0_shared",
      3682,
      4032,
      4036
    ],
    [
      0,
      "copy_p1_shared",
      3602,
      3952,
      3956
    ],
    [
      0,
      "copy_state0",
      2561,
      2701,
      2705
    ],
    [
      0,
      "copy_state1",
      3461,
      3601,
      3605
    ],
    [
      0,
      "copy_validity",
      1596,
      1710,
      1935
    ],
    [
      0,
      "pv0_left",
      2837,
      2860,
      3395
    ],
    [
      0,
      "pv0_right",
      4144,
      4167,
      4712
    ],
    [
      0,
      "pv1_left",
      4167,
      4190,
      4735
    ],
    [
      0,
      "pv1_right",
      3438,
      3461,
      3996
    ],
    [
      0,
      "qk0_0",
      539,
      562,
      723
    ],
    [
      0,
      "qk0_1",
      1703,
      1726,
      1887
    ],
    [
      0,
      "qk0_2",
      1793,
      1816,
      1977
    ],
    [
      0,
      "qk0_3",
      1679,
      1702,
      1863
    ],
    [
      0,
      "qk0_4",
      1565,
      1588,
      1749
    ],
    [
      0,
      "qk0_5",
      1451,
      1474,
      1635
    ],
    [
      0,
      "qk0_6",
      1337,
      1360,
      1521
    ],
    [
      0,
      "qk0_7",
      1223,
      1246,
      1407
    ],
    [
      0,
      "qk0_8",
      425,
      448,
      609
    ],
    [
      0,
      "qk1_0",
      2135,
      2158,
      2319
    ],
    [
      0,
      "qk1_1",
      2249,
      2272,
      2433
    ],
    [
      0,
      "qk1_2",
      1931,
      1954,
      2115
    ],
    [
      0,
      "qk1_3",
      2363,
      2386,
      2547
    ],
    [
      0,
      "qk1_4",
      1908,
      1931,
      2092
    ],
    [
      0,
      "qk1_5",
      653,
      676,
      837
    ],
    [
      0,
      "qk1_6",
      2477,
      2500,
      2661
    ],
    [
      0,
      "qk1_7",
      2272,
      2295,
      2456
    ],
    [
      0,
      "qk1_8",
      995,
      1018,
      1179
    ],
    [
      0,
      "scale_o_left0",
      2701,
      2836,
      2836
    ],
    [
      0,
      "scale_o_left1",
      4032,
      4167,
      4167
    ],
    [
      0,
      "scale_o_right",
      3303,
      3438,
      3438
    ],
    [
      0,
      "scale_p0",
      3605,
      3682,
      3682
    ],
    [
      0,
      "softmax0",
      1977,
      2561,
      2561
    ],
    [
      0,
      "softmax1",
      2705,
      3303,
      3303
    ],
    [
      1,
      "copy_kv0_0",
      3976,
      4090,
      4401
    ],
    [
      1,
      "copy_kv0_1",
      4672,
      4786,
      5097
    ],
    [
      1,
      "copy_kv0_2",
      5584,
      5698,
      6009
    ],
    [
      1,
      "copy_kv0_3",
      5470,
      5584,
      5895
    ],
    [
      1,
      "copy_kv0_4",
      5356,
      5470,
      5781
    ],
    [
      1,
      "copy_kv0_5",
      5242,
      5356,
      5667
    ],
    [
      1,
      "copy_kv0_6",
      5128,
      5242,
      5553
    ],
    [
      1,
      "copy_kv0_7",
      5014,
      5128,
      5439
    ],
    [
      1,
      "copy_kv0_8",
      3806,
      3920,
      4231
    ],
    [
      1,
      "copy_kv1_0",
      5926,
      6040,
      6351
    ],
    [
      1,
      "copy_kv1_1",
      6040,
      6154,
      6465
    ],
    [
      1,
      "copy_kv1_2",
      5698,
      5812,
      6123
    ],